# - date: # date de l'event, format JJ/MM/AAAA
#   post: # nom du fichier dans _posts sans l'extension, par ex 2020-11-12-13-eme-event 
#   title: # titre de l'event, utiliser <br> pour passer à la ligne si trop long
#   img:  # chemin relatif vers une image 400x400 pixel, par ex ./img/event26/francois-desmier.jpg conditionne l'affichage dans RESSOURCES
#   resources:
#     - title: # texte de la ressource, par ex Les slides de François
#       url:   # URL associée au texte, par ex https://blabla
#     - title: # Deuxième ressource et ainsi de suite
#       url: 
- date: 31/03/2026
  post: 2026-03-31-65-eme-event
  title: "Du silence à la sécurité psychologique"
  img: /img/event65/benoit.jpg
  resources:
    - title: Slides de Benoît
      url: 
    - title: La vidéo de la conférence
      url: 
    - title: Les slides TADx
      url: 

- date: 03/02/2026
  post: 2026-02-03-64-eme-event
  title: "Mesurer l'Invisible : </br>Comment prouver la valeur de vos pratiques Craft"
  img: /img/event64/dorra.jpg
  resources:
    - title: Slides de Dorra
      url: 
    - title: La vidéo de la conférence
      url: https://youtu.be/GHibRBsDlr0
    - title: Les slides TADx
      url: https://docs.google.com/presentation/d/e/2PACX-1vQZJFi4kxZ1rvefYKnPY13Ym_rLEjgRGVgGxdEILFUtVp5_d1kfcIWslwdoUGt6eA/pub?start=false&loop=false&delayms=3000

- date: 06/01/2026
  post: 2026-01-06-63-eme-event
  title: "Gitflow c'est bien, Gitbutler c'est mieux !"
  img: /img/event63/lillian-yann-thomas.png
  resources:
    - title: Slides de Lilian & Yann-Thomas
      url: https://docs.google.com/presentation/d/e/2PACX-1vTPJdZ8Peb-dSP_mT52JzS0C9dQ9JxKc2Wo-soISjiIv0cv17UasL0C0fOvkOrJSw/pub
    - title: La vidéo de la conférence
      url: https://youtu.be/r96ciUOzlhA
    - title: Les slides TADx
      url: https://docs.google.com/presentation/d/e/2PACX-1vT_r1qaOniJkiGFyiEffcU9LFjyFT9Q-JpJlJ76OyEBW2qLismZYbWcA9NQ7CUGHQ/pub

- date: 16/12/2025
  post: 2025-12-16-62-eme-event
  title: "Les petits secrets de Compose & Dragons"
  img: /img/event62/guillaume-philippe.png
  resources:
    - title: Slides et code source de Guillaume & Philippe
      url: https://github.com/Compose-and-Dragons/dungeon.v3
    - title: La vidéo de la conférence
      url: https://youtu.be/gAxO98-FEd4
    - title: Les slides TADx
      url: https://docs.google.com/presentation/d/e/2PACX-1vRgvcItyzslsynUGXPWkqY8DTlGRJl-Yz_Gm2VE4Bi7-FUV46eFzJ1OCF8fJFjbsQ/pub

- date: 25/11/2025
  post: 2025-11-25-61-eme-event
  title: "Apprendre à coder ou comment s’amuser de 7 à 77 ans"
  img: /img/event61/thierry.jpg
  resources:
    - title: Slides de Thierry
      url: https://docs.google.com/presentation/d/1g3JG28WTuRzQOu24793B7MUzEa8xMw1_v06ryuVgDuo/edit?slide=id.g2a4e1e59b1c_1_422#slide=id.g2a4e1e59b1c_1_422
    - title: La vidéo de la conférence
      url: https://youtu.be/rcx350doz2g
    - title: Les slides TADx
      url: https://docs.google.com/presentation/d/e/2PACX-1vSUVIDSFvtcd9zsxyiPMI3zaS9BvqYcP9W3c2_aKWNEMl9xWBzeph9-rMLqtcUpTw/pub

- date: 28/10/2025
  post: 2025-10-28-60-eme-event
  title: "Kubernetes : 5 façons créatives de flinguer sa prod"
  img: /img/event60/denis.jpg
  resources:
    - title: Slides de Denis
      url: https://blog.zwindler.fr/talks/2025-kubernetes-5-facon-de-flinguer-prod/index.html
    - title: La vidéo de la conférence
      url: https://youtu.be/S0CsudsUueU
    - title: Les slides TADx
      url: https://docs.google.com/presentation/d/e/2PACX-1vQ_zsA_CEIiePF1_PyjgGeib0Vkd9F74Qff6W3e1vEtNlY_MTXczk_UIVXwhwFLqA/pub

- date: 16/09/2025
  post: 2025-09-16-59-eme-event
  title: "AI Agents — the new frontier for LLMs"
  img: /img/event59/guillaume.jpg
  resources:
    - title: Slides de Guillaume
      url: https://speakerdeck.com/glaforge/ai-agents-the-new-frontier-for-llms-5d593e22-b125-4f36-962c-f852dab99aee
    - title: La vidéo de la conférence
      url: https://youtu.be/0nqxN3fyg1E
    - title: Les slides TADx
      url: https://docs.google.com/presentation/d/e/2PACX-1vRLT2PMZSDt8Kjg77N6V2G6-mOthGBZeWWVHbwvRzJeq3xGR73UQWGqb15wiU8C8w/pub?start=false

- date: 11/06/2025
  post: 2025-06-10-58-eme-event
  title: "3 ans de migrations en environnement \"cloud native\" <br/>quand on n'est ni une startup, ni dans le CAC4"
  img: /img/event58/remi.jpg
  resources:
    - title: Slides de Rémi
      url: https://presentations.verchere.fr/Migration_Cloud_ETI_Tadx_2025/
    - title: La vidéo de la conférence
      url: https://youtu.be/wVGv1jdKF0s
    - title: Les slides TADx
      url: https://docs.google.com/presentation/d/e/2PACX-1vTv3UJvShY-dhMf8hzwoxjb5rcC91Ah5AS2hxDoY3uXVL2BQZs2yFmTNyf0MLWlyg/pub

- date: 14/05/2025
  post: 2025-05-14-57-eme-event
  title: "Spotify, an insider view"
  img: /img/event57/rachel-dubois.jpg
  resources:
    - title: Slides de Rachel
      url: https://drive.google.com/file/d/1h9QL5bALa6DubZlAwHr-i3fFTUXv7psH/view?usp=sharing
    - title: La vidéo de la conférence
      url: https://youtu.be/AmUQoPIMucs
    - title: Les slides TADx
      url: https://docs.google.com/presentation/d/e/2PACX-1vSJUBGeV5Ms6OCVMAnJQCBg89Ckc-vCSe4iTcxGPZ2kEH6-Vzn6czW69DyZToj4nQ/pub

- date: 08/04/2025
  post: 2025-04-18-56-eme-event
  title: "Taskfile, le Makefile sous stéroïde !"
  img: /img/event56/valentin.jpg
  resources:
    - title: Slides de Valentin
      url: 
    - title: La vidéo de la conférence
      url: https://youtu.be/0Bl9L6Og4MA
    - title: Les slides TADx
      url: https://docs.google.com/presentation/d/e/2PACX-1vQfZ4Px76jkaLowbcDjNiy_DdP1alem_D_jiclw3htP8RDcFwcIxifzwuNxPsuX4g/pub

- date: 19/03/2025
  post: 2025-03-19-55-eme-event
  title: "Soirée inclusion dans le numérique </br>et l'intelligence artificielle"
  img: /img/event55/noemie.png
  resources:
    - title: Slides de Noémie
      url: https://drive.google.com/file/d/1jMXhzA4PmkZq6ZrBNNMjBIY9pBCepTI1/view?usp=drive_link
    - title: La vidéo de la conférence
      url: https://youtu.be/nO_IjgJgqjo
    - title: Les slides TADx
      url: https://docs.google.com/presentation/d/e/2PACX-1vQBierZB_ql8xtRoKaP1H18UirAzMA9auU6_0fUefn6vajgY_9xMPe1Yg7x8_LoiA/pub

- date: 18/02/2025
  post: 2025-02-18-54-eme-event
  title: "Software teaming : onboarding, remote, productivité, <br>Rex d’une développeuse "
  img: /img/event54/marjorie.jpg
  resources:
    - title: Slides de Marjorie
      url: https://docs.google.com/presentation/d/1AbIx9KhDoKzFbvgqDviF5rtxCiHzvERMndX96pFkAcg/edit#slide=id.g336f97f2934_0_25
    - title: La vidéo de la conférence
      url: https://youtu.be/72duMgXY37U
    - title: Les slides TADx
      url: https://docs.google.com/presentation/d/e/2PACX-1vRDMku7Lp73rCjlgHuk2Wi1fiXu8-0BYUpsnUq2MnhflfBygzYDhZkijazbybwfBQ/pub

- date: 7/01/2025
  post: 2025-01-07-53-eme-event
  title: "Les feature flags : </br>le couteau suisse de votre flow de développement"
  img: /img/event53/benjamin.jpg
  resources:
    - title: Slides de Benjamin
      url: https://drive.google.com/file/d/11FpwXwHjnP2yNMJw-_murzoPgrfPOA-e/
    - title: La vidéo de la conférence
      url: https://youtu.be/vkXaFgRZvQ8
    - title: Les slides TADx
      url: https://docs.google.com/presentation/d/e/2PACX-1vTRQhTiLWzj35qSWHXV36rHQNj6LqrGIkhIRHsnJdGwq19q0_K7DbkeehrSgGoODA/pub

- date: 12/11/2024
  post: 2024-12-11-51-eme-event
  title: "📝 ✅ La checklist ultime pour rendre vos </br>applications cloud native !"
  img: /img/event51/katia.jpg
  resources:
    - title: Slides de Katia
      url: https://t.co/DD6QVMsYan
    - title: La vidéo de la conférence
      url: https://youtu.be/8jgb1NvnC_Y
    - title: Les slides TADx
      url: https://docs.google.com/presentation/d/e/2PACX-1vT6w0YHhmB6claLydhNjKsU1xsUMC82_qEAm0p9Ow-1czuEpR4rOF_zOuKtnho03w/pub


- date: 15/10/2024
  post: 2024-10-15-50-eme-event
  title: "Équilibre de vie et gestion du temps : </br>améliorez votre quotidien !"
  img: /img/event50/peggy.jpg
  resources:
    - title: Slides de Peggy
      url: https://drive.google.com/file/d/1SrLUGtOniNRJdf5SQm86rQKaBEwkow7g/view?usp=drive_link
    - title: La vidéo de la conférence
      url: https://youtu.be/Rlh6GOgnc3c
    - title: Les slides TADx
      url: https://docs.google.com/presentation/d/1HzfRd4bJhcnoSZ8M0--s4Q-adH-IDcJo/edit?usp=drive_link&ouid=116474222764621363953&rtpof=true&sd=true

- date: 17/09/2024
  post: 2024-09-17-49-eme-event
  title: "Comment nous avons transformé les Restos du Cœur </br>en Cloud Provider"
  img: /img/event49/julien.jpg
  resources:
    - title: Slides de Julien
      url: https://speakerdeck.com/ju_hnny5/tadx-2024-comment-nous-avons-transforme-les-restos-du-coeur-en-cloud-provider
    - title: La vidéo de la conférence
      url: https://youtu.be/56l5EnCiW1k
    - title: Les slides TADx
      url: https://docs.google.com/presentation/d/e/2PACX-1vSssnYrDLTgShGrNM10XkXh4fTUgJBAUbf6-2P76G1JmYWkuZXX2LKTJHSbb8JelQ/pub


- date: 25/06/2024
  post: 2024-06-25-48-eme-event
  title: "Mais qui a tué le chat de Lemni ?<br> Une enquête dans l’univers du DevOps"
  #img: /img/event48/philippe.morisseau.jpg
  resources:
    - title: Slides de Philippe
      url: 
    - title: La vidéo de la conférence
      url: 
    - title: Les slides TADx
      url: 

- date: 21/05/2024
  post: 2024-05-21-47-eme-event
  title: "Elasticsearch Query Language: ES|QL"
  img: /img/event47/david.jpg
  resources:
    - title: Slides de David
      url: https://speaker.pilato.fr/snE5A3
    - title: La vidéo de la conférence
      url: https://t.co/fsuugXWG7d
    - title: Les slides TADx
      url: https://docs.google.com/presentation/d/e/2PACX-1vTB8-J32hpQMeoL2l6Zhw8b5Xr5C1tsTiIEzTDn35gnFOCkj4qG-mD9SWwrEwqLbw/pub?start=false&loop=false&delayms=3000

- date: 30/04/2024
  post: 2024-04-30-46-eme-event
  title: "🍳 Recette pour des environnements </br>aux petits oignons pour ton déploiement continu 🚀"
  img: /img/event46/thomas-matthieu.png
  resources:
    - title: Slides de Matthieu et Thomas
      url: https://tadx.grunty.uk/
    - title: La vidéo de la conférence
      url: https://youtu.be/pxZmW1HmOaw
    - title: Les slides TADx
      url: https://docs.google.com/presentation/d/e/2PACX-1vTlhfiftevmDDCxrgQt3oayLrn0hx_PMFrLYUfgzZuNZgCSg8v9rrdwb3nZpONcew/pub?start=false&loop=false&delayms=3000

- date: 18/03/2024
  post: 2024-03-18-45-eme-event
  title: "Anatomie d’une image PNG"
  img: /img/event45/sonia.jpg
  resources:
    - title: Slides de Sonia
      url: https://drive.google.com/file/d/1s3PFMQpXGVWR4rbs7SSRlNnChfTAoT82/view?usp=sharing
    - title: La vidéo de la conférence
      url: https://youtu.be/92qWa0B8PSg
    - title: Les slides TADx
      url: 

- date: 19/02/2024
  post: 2024-02-19-44-eme-event
  title: "L'AGC : retour sur l'ordinateur qui a </br> amené l'humanité sur la Lune"
  img: /img/event44/romain-olivier.png
  resources:
    - title: Slides de Romain & Olivier
      url: https://t.co/Qs275R9ddM
    - title: La vidéo de la conférence
      url: 
    - title: Les slides TADx
      url: https://docs.google.com/presentation/d/e/2PACX-1vRnNvvWRi8MYmd15pdGher0d-dQSkgL7vB2zNtQLgfIfMy9TsHXRsAvdpiyv6vGVg/pub

- date: 12/12/2023
  post: 2023-12-12-43-eme-event
  title: Et si l'IA était la solution </br> pour comprendre la langue des signes ?
  img: /img/event43/elea.jpeg
  resources:
    - title: Slides d'Eléa
      url: https://drive.google.com/file/d/1GKVU4JWQkT7bPHCvjhku6HEDjlDIPIEw/view?usp=sharing
    - title: La vidéo de la conférence
      url: https://studio.youtube.com/video/OqV1c5YSKdk/edit
    - title: Les slides TADx
      url: https://docs.google.com/presentation/d/e/2PACX-1vS2cRZcqES8ttOrgkqKijy5fRNOhKwWOXrYK3yWdjF5dTMQIDf_2LIczo7op7dc3Q/pub

- date: 13/11/2023
  post: 2023-11-13-42-eme-event
  title: Apprends à dompter la Data sans douter de toi !
  img: /img/event42/johanna.jpg
  resources:
    - title: Slides de Johanna
      url: https://jvauchel.github.io/dompter-data-talk-2023/index-tadx.html
    - title: La vidéo de la conférence
      url: https://youtu.be/5f29X4RiWCI
    - title: Les slides TADx
      url: https://docs.google.com/presentation/d/e/2PACX-1vTipLqfI1jd1mXTjOUerYmevoqB3JX4yFJrf08jwgCHG8CBaIGsIKuaiS4acRp3iA/pub

- date: 16/10/2023
  post: 2023-10-16-41-eme-event
  title: A la découverte d'accelerate.
  img: /img/event41/geoffrey-graveaud.jpg
  resources:
    - title: Slides de Geoffrey
      url: https://drive.google.com/file/d/1G4OA32q2uxzM7u_eWLLT_zW4rdRVDrT2/view?usp=sharing
    - title: La vidéo de la conférence
      url: https://youtu.be/jD8c_eboWSo
    - title: Les slides TADx
      url: https://docs.google.com/presentation/d/e/2PACX-1vQ7wUjG_XMm3JDs41sZaHqVYt3SXd2cbZ1vFYoa-cV4xnFfyO3cWCbpxQElM88gsw/pub

- date: 18/09/2023
  post: 2023-09-18-40-eme-event
  title: Quelle est la place des introverti•e•s dans une équipe agile.
  img: /img/event40/anais.jpg
  resources:
    - title: Slides d'Anaïs
      url: https://drive.google.com/file/d/1TXy7CnbPaE-j_dT_8fhoFNZzgj85hqlG/view?usp=sharing
    - title: La vidéo de la conférence
      url: https://youtu.be/D26FIreuIgQ
    - title: Les slides TADx
      url: https://docs.google.com/presentation/d/e/2PACX-1vSdL7O0DFYYj-23zZMsL3-Mwy8efi2TFHwhNyjJSoLZYJSoh7nxDDzUwazB9G0Dcw

- date: 6/06/2023 
  post: 2023-06-06-39-eme-event  
  title: Intégrer les parties prenantes
  img: /img/event39/simon.jpg
  resources:
    - title: Slides de Simon
      url: https://drive.google.com/file/d/1BgsUqaR-uRj01eN9PsvuN0bGph5LMXPh/view?usp=sharing
    - title: La vidéo de la conférence
      url: https://youtu.be/F5Xdo1pSzcc
    - title: Les slides TADx
      url: https://docs.google.com/presentation/d/e/2PACX-1vRhRqCLvkUNe5xk23WM5S9MBLHP9C_QCMRF-BxJG6pY0PvnroI2HtjIWlZy3ne48g/pub?start=false&loop=false&delayms=3000

- date: 16/05/2023 
  post: 2023-05-16-38-eme-event  
  title: GitLab 💚 Kubernetes
  img:  /img/event38/jeanphieric.png
  resources:
    - title: Slides de Jean-Philippe et Eric
      url: https://docs.google.com/presentation/d/1PcfSA--1oBqLQj6K9BgEjFo0ZSD4kdTg3fSK2wkHO4M/edit?usp=sharing 
    - title: La vidéo de la conférence
      url: https://youtu.be/HpWgfOzCLok
    - title: Les slides TADx
      url: https://docs.google.com/presentation/d/e/2PACX-1vRoaz-afd3MAE1FH0C2VyEGxqmGct5gP0AN3atyJAeieye3riMFIP_dwwR8W9-mmg/pub?start=false&loop=false&delayms=3000

- date: 4/04/2023 
  post: 2023-04-04-37-eme-event
  title: Donnez des super pouvoirs à vos applications </br> Java (et Node.js) avec des plugins WebAssembly avec Extism.
  img: /img/event37/philippe.jpg 
  resources:
    - title: Slides de Philippe
      url:  https://docs.google.com/presentation/d/e/2PACX-1vQEhEVtoB6ajtDDRCUPiX5JbnVJdQ93gC-FSxF_5P71XYBZLi4lkb1_PkgCnaRyEA/
    - title: La vidéo de la conférence
      url: https://youtu.be/N-6fAiSM-BI
    - title: Les slides TADx
      url:

- date: 21/03/2023 
  post: 2023-03-21-36-eme-event
  title: "Une plateforme à concevoir,<br> deux architectes: trois possibilités ?"
  img: /img/event36/AlexRaph.png
  resources:
    - title: Slides d'Alexandre et Raphaël
      url: https://speakerdeck.com/alexandretouret/tadx-23-une-plateforme-a-concevoir-deux-architectes-trois-possibilites  
    - title: La vidéo de la conférence
      url: https://youtu.be/Mkol6zyJN8Y
    - title: Les slides TADx
      url: https://docs.google.com/presentation/d/e/2PACX-1vRApiBVM5OyN4p1Uo6h7aaosJE44V0BHFQanFreCuzU4Y6cQ4d4aGhDdPzNRFRXqA/pub?start=false

- date: 21/02/2023 
  post: 2023-02-21-35-eme-event
  title:  Green agile - responsabilité et agilité numérique,<br> un grand système à transformer ensemble !
  img: /img/event35/gwenaelle-hirrien.jpg 
  resources:
    - title: Slides de Gwénaëlle
      url: https://drive.google.com/file/d/1x5yrscB24RXwDJurMYnhGrkBRT5i9w53/view
    - title: La vidéo de la conférence
      url: https://youtu.be/htU_sCL6mi8
    - title: Les slides TADx
      url: https://docs.google.com/presentation/d/e/2PACX-1vRDNeyUpNBw8ruEV2izHgw--wU2F0LUfhz0h7dmnHH-IqO7_sKv_Jm2K1Mu-MXusA/pub

- date: 24/01/2023 
  post: 2023-01-24-34-eme-event
  title: Cybersécurité et générateurs de nombres aléatoires
  img: /img/event34/mathis-hammel.jpg
  resources:
    - title: Slides de Mathis
      url: https://docs.google.com/presentation/d/1dShq6zpu-_DZemcPEvdKJ-PXHm-2g5dzBtGmJrP-hN4/edit?usp=sharing
    - title: La vidéo de la conférence
      url: https://www.youtube.com/watch?v=ow1Xd0H9rtU
    - title: Les slides TADx
      url: https://docs.google.com/presentation/d/e/2PACX-1vSLecM_ss4InMvwpv176SssweAQs1ipGvTSILHmOrAqwt5NvXnHbGG46tkphogD3A/pub?start=false&loop=false&delayms=3000

- date: 13/12/2022 
  post: 2022-12-13-33-eme-event
  title: Mais, à quoi ça sert un DevRel ?
  img: /img/event33/aurelie-horacio.png
  resources:
    - title: Slides d'Aurélie et Horacio
      url:  https://noti.st/aurelievache/71J7b9/mais-cest-quoi-le-devrel
    - title: La vidéo de la conférence
      url: https://www.youtube.com/watch?v=CzCm5VIWpWI
    - title: Les slides TADx
      url: https://docs.google.com/presentation/d/e/2PACX-1vT2_goTc04T0EATwuZaf2Zq0ooSjZMXFEZTeRigY5NNGKudna4Kl6_HFwCzI_GA3A/pub?start=false&loop=false&delayms=3000

- date: 28/11/2022 
  post: 2022-11-28-32-eme-event
  title: GitOps , une mise en situation un peu réaliste<br> sur Kubernetes avec Flux
  img:  /img/event32/laurentLudo.png
  resources:
    - title: Slides de Laurent et Ludovic
      url: https://gitops.training/
    - title: La vidéo de la conférence
      url: https://youtu.be/5kBskAroPoM
    - title: Les slides TADx
      url: https://docs.google.com/presentation/d/e/2PACX-1vRvuhqcfrRrgcqutc-XGWof8KuRiL60S9YiBgWVDf-QYURmYb8UATfhV8QEFfN6hg/pub?start=false

- date: 18/10/2022 
  post: 2022-11-08-31-eme-event
  title: Est-il possible de réduire l'aide infligée ?
  img: /img/event31/julieRomeu.png
  resources:
#    - title: Slides de Julie et Romeu
#      url:  
    - title: La vidéo de la conférence
      url: https://youtu.be/4lyklaaUC3g
    - title: Les slides TADx
      url: https://docs.google.com/presentation/d/e/2PACX-1vQm0t9qPJGCyGGGFUn0lIq-xr3LiDCxujiKj1ImuVww7c-bZ4RdPQUN9wTO68Bs6w/pub?start=false

- date: 20/09/2022 
  post: 2022-09-20-30-eme-event
  title: CI/CD, le divorce serait-il prononcé ?
  img: /img/event30/NicolasYann.png
  resources:
    - title: Slides de Nicolas et Yann
      url: https://arcanneero.github.io/cicd-divorce-slides/story/index-tadx.html#/ 
    - title: La vidéo de la conférence
      url: https://youtu.be/k9G5R-WJdys
    - title: Les slides TADx
      url: https://docs.google.com/presentation/d/e/2PACX-1vSgW6qjuKKXZTrNAjtTJziTy8pOJx9sRZMOO-ao_h6X9jd6gKy3U8D17LFJnEFMng/pub?start=false&loop=false&delayms=3000

- date: 28/06/2022 
  post: 2022-06-28-29-eme-event
  title: Comment maximiser l'effet "nouveau venu",<br> moteur du changement dans une équipe ?
  img:  /img/event29/Simon.jpg
  resources:
    - title: Slides de Simon
      url:  https://drive.google.com/file/d/1BVeW0HpMRt44-IS0tG4hCW6qHHZcIEIg/view?usp=sharing
    - title: La vidéo de la conférence
      url: https://youtu.be/zm7Cj_l8jAQ
    - title: Les slides TADx
      url: https://docs.google.com/presentation/d/e/2PACX-1vSxviSFghyZ-EEKh1SEAcCNOPPG8febFJznLuvXIT1Y6ogUyyjz4hr3WcIu9pn_3g/pub?start=false&loop=false&delayms=3000

- date: 30/05/2022 
  post: 2022-05-10-28-eme-event
  title: L'agilité au secours d'un neuro atypique :<br> mieux vivre grâce à cette méthode
  img:  /img/event28/benjamin.jpg
  resources:
    - title: Slides de Benjamin
      url:   https://fr.slideshare.net/BenjaminDauvissat/lagilit-au-secours-dun-neuro-atypique
    - title: La vidéo de la conférence
      url: https://youtu.be/xXxFnaESKqI
    - title: Les slides TADx
      url: https://docs.google.com/presentation/d/e/2PACX-1vTcP7f8ax82wMOVilTF3z9Eo6p1DO78lvpQPw6oNH2qTKO2ctPX0_0wuDDTdRD0zg/pub?start=false&loop=false&delayms=3000

- date: 03/05/2022
  post: 2022-04-06-27-eme-event
  title: Tremplin Camping des speakers

- date: 21/04/2022
  title: BOF Devoxx 2022

- date: 11/03/2022
  post: 2022-03-11-26-eme-event
  title: Agilité "at scale"
  img: ./img/event26/francois-desmier.jpg
  resources:
    - title: Les slides de François
      url: https://maif-my.sharepoint.com/:p:/g/personal/francois_desmier_maif_fr/EbtZTTd81XFHuS-bTI_EZ7IBR7Ysq-_Pnrxswp5ro87ALA?rtime=1n4QAl022kg
    - title: La vidéo de la conférence
      url: https://youtu.be/Bn7UaaELOGg
    - title: Slides de TADx
      url: https://docs.google.com/presentation/d/e/2PACX-1vRq51A3WeeuYJGcdNJEX85R7ITxiS3CUPFynbkkhqCrPg9aiTDRzsY-JJ1--5aQDA/pub?start=false&loop=false&delayms=3000

- date: 25/02/2022
  post: 2022-02-14-25-eme-event
  title: "Elm : un langage front-end qui vous veut du bien"
  img: ./img/event25/jordane.jpg
  resources:
    - title: Les slides de Jordane
      url: https://slides.com/ereold/elm-frontend-heureux/
    - title: Le code de Jordane
      url: https://github.com/jgrenat/elm-corgis
    - title: La vidéo de la conférence
      url: https://youtu.be/Q8viY48ORnw
    - title: Slides de TADx
      url: https://docs.google.com/presentation/d/e/2PACX-1vQpxst3XjfjGAvIdKwKWpgPC3fiwhBxAXBPA7vCq5hynf8NdGHG0VE7XuJMDLrdOg/pub?start=false&loop=false&delayms=3000

- date: 25/01/2022
  post: 2022-01-09-24-eme-event
  title: Knative, la solution Serverless native de Kubernetes <br> mais pas que !
  img: ./img/event24/seb.jpg
  resources:
    - title: Les slides de Sébastien
      url: https://t.co/mKHAfGuw3z
    - title: Le code source de Sébastien
      url: https://t.co/2hTOyNbkHq
    - title: La vidéo de la conférence
      url: https://youtu.be/chh6-xAVrZs
    - title: Slides de TADx
      url: https://docs.google.com/presentation/d/e/2PACX-1vQz0QERQoQv7odHIodecgJijoYBx7bcDHqtNtXVMHduj1bFkBHHtOk5F9mEet82Kw/pub?start=false&loop=false&delayms=3000

- date: 14/12/2021
  post: 2021-12-14-23-eme-event
  title: OAUTH2 expliqué simplement (même si tu n’es pas dev) !
  img: ./img/event23/julien.jpg
  resources:
    - title: Les slides de Julien
      url: https://slides.com/julientopcu/concepts-avances-authn-authz
    - title: La vidéo de la conférence
      url: https://youtu.be/TsosQ1HnLd0
    - title: Slides de TADx
      url: https://docs.google.com/presentation/d/e/2PACX-1vRR3mOwcSnkeOVAQLaxQUSRLxpzExtDDh0EAApexRtjSO4YkG8jNnZFRYUurUixdg/pub?start=false&loop=false&delayms=3000

